{
  "frontend_pages": [
    {
      "file": "frontend/src/app/[locale]/(auth)/forgot-password/page.tsx",
      "route": "/forgot-password"
    },
    {
      "file": "frontend/src/app/[locale]/(auth)/login/page.tsx",
      "route": "/login"
    },
    {
      "file": "frontend/src/app/[locale]/(auth)/magic-link-sent/page.tsx",
      "route": "/magic-link-sent"
    },
    {
      "file": "frontend/src/app/[locale]/(auth)/register/page.tsx",
      "route": "/register"
    },
    {
      "file": "frontend/src/app/[locale]/(auth)/reset-password/page.tsx",
      "route": "/reset-password"
    },
    {
      "file": "frontend/src/app/[locale]/(dashboard)/admin/conversations/page.tsx",
      "route": "/admin/conversations"
    },
    {
      "file": "frontend/src/app/[locale]/(dashboard)/admin/page.tsx",
      "route": "/admin"
    },
    {
      "file": "frontend/src/app/[locale]/(dashboard)/admin/ratings/page.tsx",
      "route": "/admin/ratings"
    },
    {
      "file": "frontend/src/app/[locale]/(dashboard)/admin/system/page.tsx",
      "route": "/admin/system"
    },
    {
      "file": "frontend/src/app/[locale]/(dashboard)/admin/users/page.tsx",
      "route": "/admin/users"
    },
    {
      "file": "frontend/src/app/[locale]/(dashboard)/chat/page.tsx",
      "route": "/chat"
    },
    {
      "file": "frontend/src/app/[locale]/(dashboard)/dashboard/page.tsx",
      "route": "/dashboard"
    },
    {
      "file": "frontend/src/app/[locale]/(dashboard)/dev/components/page.tsx",
      "route": "/dev/components"
    },
    {
      "file": "frontend/src/app/[locale]/(dashboard)/profile/page.tsx",
      "route": "/profile"
    },
    {
      "file": "frontend/src/app/[locale]/(dashboard)/rag/page.tsx",
      "route": "/rag"
    },
    {
      "file": "frontend/src/app/[locale]/(dashboard)/settings/account/page.tsx",
      "route": "/settings/account"
    },
    {
      "file": "frontend/src/app/[locale]/(dashboard)/settings/appearance/page.tsx",
      "route": "/settings/appearance"
    },
    {
      "file": "frontend/src/app/[locale]/(dashboard)/settings/integrations/page.tsx",
      "route": "/settings/integrations"
    },
    {
      "file": "frontend/src/app/[locale]/(dashboard)/settings/notifications/page.tsx",
      "route": "/settings/notifications"
    },
    {
      "file": "frontend/src/app/[locale]/(dashboard)/settings/page.tsx",
      "route": "/settings"
    },
    {
      "file": "frontend/src/app/[locale]/(dashboard)/settings/profile/page.tsx",
      "route": "/settings/profile"
    },
    {
      "file": "frontend/src/app/[locale]/(dashboard)/settings/slash-commands/page.tsx",
      "route": "/settings/slash-commands"
    },
    {
      "file": "frontend/src/app/[locale]/about/page.tsx",
      "route": "/about"
    },
    {
      "file": "frontend/src/app/[locale]/auth/callback/page.tsx",
      "route": "/auth/callback"
    },
    {
      "file": "frontend/src/app/[locale]/auth/magic-link/page.tsx",
      "route": "/auth/magic-link"
    },
    {
      "file": "frontend/src/app/[locale]/blog/[slug]/page.tsx",
      "route": "/blog/{slug}"
    },
    {
      "file": "frontend/src/app/[locale]/blog/page.tsx",
      "route": "/blog"
    },
    {
      "file": "frontend/src/app/[locale]/changelog/page.tsx",
      "route": "/changelog"
    },
    {
      "file": "frontend/src/app/[locale]/community/page.tsx",
      "route": "/community"
    },
    {
      "file": "frontend/src/app/[locale]/contact/page.tsx",
      "route": "/contact"
    },
    {
      "file": "frontend/src/app/[locale]/demo/[id]/page.tsx",
      "route": "/demo/{id}"
    },
    {
      "file": "frontend/src/app/[locale]/demo/page.tsx",
      "route": "/demo"
    },
    {
      "file": "frontend/src/app/[locale]/help/page.tsx",
      "route": "/help"
    },
    {
      "file": "frontend/src/app/[locale]/legal/cookies/page.tsx",
      "route": "/legal/cookies"
    },
    {
      "file": "frontend/src/app/[locale]/legal/privacy/page.tsx",
      "route": "/legal/privacy"
    },
    {
      "file": "frontend/src/app/[locale]/legal/terms/page.tsx",
      "route": "/legal/terms"
    },
    {
      "file": "frontend/src/app/[locale]/onboarding/[step]/page.tsx",
      "route": "/onboarding/{step}"
    },
    {
      "file": "frontend/src/app/[locale]/onboarding/page.tsx",
      "route": "/onboarding"
    },
    {
      "file": "frontend/src/app/[locale]/page.tsx",
      "route": "/"
    },
    {
      "file": "frontend/src/app/[locale]/pricing/page.tsx",
      "route": "/pricing"
    },
    {
      "file": "frontend/src/app/[locale]/security/page.tsx",
      "route": "/security"
    },
    {
      "file": "frontend/src/app/[locale]/shared/[token]/page.tsx",
      "route": "/shared/{token}"
    }
  ],
  "locales": [
    "en",
    "pl"
  ],
  "openapi": {
    "paths": [
      {
        "method": "GET",
        "path": "/api/v1/admin/conversations"
      },
      {
        "method": "GET",
        "path": "/api/v1/admin/conversations/{conversation_id}"
      },
      {
        "method": "PATCH",
        "path": "/api/v1/admin/conversations/{conversation_id}/demo"
      },
      {
        "method": "GET",
        "path": "/api/v1/admin/ratings"
      },
      {
        "method": "GET",
        "path": "/api/v1/admin/ratings/export"
      },
      {
        "method": "GET",
        "path": "/api/v1/admin/ratings/summary"
      },
      {
        "method": "GET",
        "path": "/api/v1/admin/stats"
      },
      {
        "method": "GET",
        "path": "/api/v1/admin/stripe-events"
      },
      {
        "method": "GET",
        "path": "/api/v1/admin/users"
      },
      {
        "method": "DELETE",
        "path": "/api/v1/admin/users/{user_id}"
      },
      {
        "method": "GET",
        "path": "/api/v1/admin/users/{user_id}"
      },
      {
        "method": "PATCH",
        "path": "/api/v1/admin/users/{user_id}"
      },
      {
        "method": "POST",
        "path": "/api/v1/admin/users/{user_id}/impersonate"
      },
      {
        "method": "GET",
        "path": "/api/v1/agent/models"
      },
      {
        "method": "POST",
        "path": "/api/v1/auth/login"
      },
      {
        "method": "POST",
        "path": "/api/v1/auth/logout"
      },
      {
        "method": "POST",
        "path": "/api/v1/auth/magic-link/request"
      },
      {
        "method": "POST",
        "path": "/api/v1/auth/magic-link/verify"
      },
      {
        "method": "GET",
        "path": "/api/v1/auth/me"
      },
      {
        "method": "POST",
        "path": "/api/v1/auth/password-reset/confirm"
      },
      {
        "method": "POST",
        "path": "/api/v1/auth/password-reset/request"
      },
      {
        "method": "POST",
        "path": "/api/v1/auth/refresh"
      },
      {
        "method": "POST",
        "path": "/api/v1/auth/register"
      },
      {
        "method": "POST",
        "path": "/api/v1/contact"
      },
      {
        "method": "GET",
        "path": "/api/v1/conversations"
      },
      {
        "method": "POST",
        "path": "/api/v1/conversations"
      },
      {
        "method": "GET",
        "path": "/api/v1/conversations/admin-list"
      },
      {
        "method": "GET",
        "path": "/api/v1/conversations/export"
      },
      {
        "method": "GET",
        "path": "/api/v1/conversations/shared-with-me"
      },
      {
        "method": "GET",
        "path": "/api/v1/conversations/shared/{token}"
      },
      {
        "method": "DELETE",
        "path": "/api/v1/conversations/{conversation_id}"
      },
      {
        "method": "GET",
        "path": "/api/v1/conversations/{conversation_id}"
      },
      {
        "method": "PATCH",
        "path": "/api/v1/conversations/{conversation_id}"
      },
      {
        "method": "POST",
        "path": "/api/v1/conversations/{conversation_id}/archive"
      },
      {
        "method": "GET",
        "path": "/api/v1/conversations/{conversation_id}/messages"
      },
      {
        "method": "POST",
        "path": "/api/v1/conversations/{conversation_id}/messages"
      },
      {
        "method": "DELETE",
        "path": "/api/v1/conversations/{conversation_id}/messages/{message_id}/rate"
      },
      {
        "method": "POST",
        "path": "/api/v1/conversations/{conversation_id}/messages/{message_id}/rate"
      },
      {
        "method": "GET",
        "path": "/api/v1/conversations/{conversation_id}/shares"
      },
      {
        "method": "POST",
        "path": "/api/v1/conversations/{conversation_id}/shares"
      },
      {
        "method": "DELETE",
        "path": "/api/v1/conversations/{conversation_id}/shares/{share_id}"
      },
      {
        "method": "GET",
        "path": "/api/v1/demos"
      },
      {
        "method": "GET",
        "path": "/api/v1/demos/{conversation_id}"
      },
      {
        "method": "POST",
        "path": "/api/v1/files/upload"
      },
      {
        "method": "GET",
        "path": "/api/v1/files/{file_id}"
      },
      {
        "method": "GET",
        "path": "/api/v1/files/{file_id}/info"
      },
      {
        "method": "GET",
        "path": "/api/v1/health"
      },
      {
        "method": "GET",
        "path": "/api/v1/health/live"
      },
      {
        "method": "GET",
        "path": "/api/v1/health/ready"
      },
      {
        "method": "GET",
        "path": "/api/v1/me/mcp-connections"
      },
      {
        "method": "POST",
        "path": "/api/v1/me/mcp-connections"
      },
      {
        "method": "POST",
        "path": "/api/v1/me/mcp-connections/oauth/callback"
      },
      {
        "method": "POST",
        "path": "/api/v1/me/mcp-connections/oauth/start"
      },
      {
        "method": "GET",
        "path": "/api/v1/me/mcp-connections/workspace"
      },
      {
        "method": "DELETE",
        "path": "/api/v1/me/mcp-connections/{connection_id}"
      },
      {